websiteName,URL,userName,password,notes
Yahoo,http://www.yahoo.com,myyahoousername@email.com,r~ufxx|twi,My yahoo account
Gmail,http://www.gmail.com,mygmail@gmail.com,xywtslUfxx|twi678,Primary email account for personal use
Facebook,http://www.facebook.com,myfacebookusername,kgUfxx|twi9:;,Social media account for connecting with friends and family
Amazon,http://www.amazon.com,amazonshopper@email.com,sj|ufxx|twi,Online shopping account for purchasing goods and managing orders
LinkedIn,http://www.linkedin.com,mylinkedinusername,qnUfxx|twi<=>,Professional networking account for job search and career development
Twitter,http://www.twitter.com,mytwitterhandle,y|Ufxx|twi567,Social media account for sharing updates and following trends
Instagram,http://www.instagram.com,myinstagramhandle,nlUfxx|twi89:,Photo and video sharing account for posting content and connecting with followers
Pinterest,http://www.pinterest.com,mypinterestusername,unsUfxx|twi;<=,Visual discovery and inspiration account for saving and organizing ideas
Netflix,http://www.netflix.com,mynetflixusername,sjykqn}Ufxx|twi6:5,Streaming service account for watching movies and TV shows